{
  "schemaVersion": "0.1",
  "id": "3f1c0a7e-5b44-4d2a-8c11-0a1b2c3d4e5f",
  "name": "REF-1 painel solar, bateria e LEDs",
  "createdAt": "2026-10-18T16:00:00-03:00",
  "idea": "Painel solar de 18 V carregando uma bateria de 12 V que alimenta uma fita de LEDs com resistor. Os LEDs ficam ligados 6 h por dia e o painel tem 5 h de sol pico.",
  "modules": {
    "circuits": {
      "components": [
        {
          "id": "PV1",
          "type": "solar_panel",
          "params": {
            "openCircuitVoltage": "18 V",
            "seriesResistance": "5 Ω",
            "ratedPower": "20 W"
          },
          "pins": [
            "+",
            "-"
          ],
          "layout": {
            "x": 120,
            "y": 160,
            "rotation": 0
          }
        },
        {
          "id": "S1",
          "type": "switch",
          "params": {
            "state": "open",
            "Ron": "1 mΩ",
            "Roff": "1 GΩ"
          },
          "pins": [
            "1",
            "2"
          ],
          "layout": {
            "x": 300,
            "y": 160,
            "rotation": 0
          }
        },
        {
          "id": "S2",
          "type": "switch",
          "params": {
            "state": "closed",
            "Ron": "1 mΩ",
            "Roff": "1 GΩ"
          },
          "pins": [
            "1",
            "2"
          ],
          "layout": {
            "x": 560,
            "y": 160,
            "rotation": 0
          }
        },
        {
          "id": "BAT1",
          "type": "battery",
          "params": {
            "nominalVoltage": "12 V",
            "internalResistance": "0,1 Ω",
            "capacity": "7 Ah",
            "usableDepthOfDischarge": "0,5"
          },
          "pins": [
            "+",
            "-"
          ],
          "layout": {
            "x": 440,
            "y": 340,
            "rotation": 270
          }
        },
        {
          "id": "GND",
          "type": "ground",
          "params": {},
          "pins": [
            "g"
          ],
          "layout": {
            "x": 440,
            "y": 560,
            "rotation": 0
          }
        },
        {
          "id": "R1",
          "type": "resistor",
          "params": {
            "resistance": "150 Ω",
            "powerRating": "0,25 W"
          },
          "pins": [
            "1",
            "2"
          ],
          "layout": {
            "x": 780,
            "y": 160,
            "rotation": 90
          }
        },
        {
          "id": "L1A",
          "type": "led",
          "params": {
            "forwardVoltage": "3 V",
            "forwardCurrent": "20 mA",
            "color": "branco"
          },
          "pins": [
            "A",
            "K"
          ],
          "layout": {
            "x": 780,
            "y": 320,
            "rotation": 90
          }
        },
        {
          "id": "L1B",
          "type": "led",
          "params": {
            "forwardVoltage": "3 V",
            "forwardCurrent": "20 mA",
            "color": "branco"
          },
          "pins": [
            "A",
            "K"
          ],
          "layout": {
            "x": 780,
            "y": 480,
            "rotation": 90
          }
        },
        {
          "id": "L1C",
          "type": "led",
          "params": {
            "forwardVoltage": "3 V",
            "forwardCurrent": "20 mA",
            "color": "branco"
          },
          "pins": [
            "A",
            "K"
          ],
          "layout": {
            "x": 780,
            "y": 640,
            "rotation": 90
          }
        },
        {
          "id": "R2",
          "type": "resistor",
          "params": {
            "resistance": "150 Ω",
            "powerRating": "0,25 W"
          },
          "pins": [
            "1",
            "2"
          ],
          "layout": {
            "x": 900,
            "y": 160,
            "rotation": 90
          }
        },
        {
          "id": "L2A",
          "type": "led",
          "params": {
            "forwardVoltage": "3 V",
            "forwardCurrent": "20 mA",
            "color": "branco"
          },
          "pins": [
            "A",
            "K"
          ],
          "layout": {
            "x": 900,
            "y": 320,
            "rotation": 90
          }
        },
        {
          "id": "L2B",
          "type": "led",
          "params": {
            "forwardVoltage": "3 V",
            "forwardCurrent": "20 mA",
            "color": "branco"
          },
          "pins": [
            "A",
            "K"
          ],
          "layout": {
            "x": 900,
            "y": 480,
            "rotation": 90
          }
        },
        {
          "id": "L2C",
          "type": "led",
          "params": {
            "forwardVoltage": "3 V",
            "forwardCurrent": "20 mA",
            "color": "branco"
          },
          "pins": [
            "A",
            "K"
          ],
          "layout": {
            "x": 900,
            "y": 640,
            "rotation": 90
          }
        },
        {
          "id": "R3",
          "type": "resistor",
          "params": {
            "resistance": "150 Ω",
            "powerRating": "0,25 W"
          },
          "pins": [
            "1",
            "2"
          ],
          "layout": {
            "x": 1020,
            "y": 160,
            "rotation": 90
          }
        },
        {
          "id": "L3A",
          "type": "led",
          "params": {
            "forwardVoltage": "3 V",
            "forwardCurrent": "20 mA",
            "color": "branco"
          },
          "pins": [
            "A",
            "K"
          ],
          "layout": {
            "x": 1020,
            "y": 320,
            "rotation": 90
          }
        },
        {
          "id": "L3B",
          "type": "led",
          "params": {
            "forwardVoltage": "3 V",
            "forwardCurrent": "20 mA",
            "color": "branco"
          },
          "pins": [
            "A",
            "K"
          ],
          "layout": {
            "x": 1020,
            "y": 480,
            "rotation": 90
          }
        },
        {
          "id": "L3C",
          "type": "led",
          "params": {
            "forwardVoltage": "3 V",
            "forwardCurrent": "20 mA",
            "color": "branco"
          },
          "pins": [
            "A",
            "K"
          ],
          "layout": {
            "x": 1020,
            "y": 640,
            "rotation": 90
          }
        },
        {
          "id": "R4",
          "type": "resistor",
          "params": {
            "resistance": "150 Ω",
            "powerRating": "0,25 W"
          },
          "pins": [
            "1",
            "2"
          ],
          "layout": {
            "x": 1140,
            "y": 160,
            "rotation": 90
          }
        },
        {
          "id": "L4A",
          "type": "led",
          "params": {
            "forwardVoltage": "3 V",
            "forwardCurrent": "20 mA",
            "color": "branco"
          },
          "pins": [
            "A",
            "K"
          ],
          "layout": {
            "x": 1140,
            "y": 320,
            "rotation": 90
          }
        },
        {
          "id": "L4B",
          "type": "led",
          "params": {
            "forwardVoltage": "3 V",
            "forwardCurrent": "20 mA",
            "color": "branco"
          },
          "pins": [
            "A",
            "K"
          ],
          "layout": {
            "x": 1140,
            "y": 480,
            "rotation": 90
          }
        },
        {
          "id": "L4C",
          "type": "led",
          "params": {
            "forwardVoltage": "3 V",
            "forwardCurrent": "20 mA",
            "color": "branco"
          },
          "pins": [
            "A",
            "K"
          ],
          "layout": {
            "x": 1140,
            "y": 640,
            "rotation": 90
          }
        },
        {
          "id": "R5",
          "type": "resistor",
          "params": {
            "resistance": "150 Ω",
            "powerRating": "0,25 W"
          },
          "pins": [
            "1",
            "2"
          ],
          "layout": {
            "x": 1260,
            "y": 160,
            "rotation": 90
          }
        },
        {
          "id": "L5A",
          "type": "led",
          "params": {
            "forwardVoltage": "3 V",
            "forwardCurrent": "20 mA",
            "color": "branco"
          },
          "pins": [
            "A",
            "K"
          ],
          "layout": {
            "x": 1260,
            "y": 320,
            "rotation": 90
          }
        },
        {
          "id": "L5B",
          "type": "led",
          "params": {
            "forwardVoltage": "3 V",
            "forwardCurrent": "20 mA",
            "color": "branco"
          },
          "pins": [
            "A",
            "K"
          ],
          "layout": {
            "x": 1260,
            "y": 480,
            "rotation": 90
          }
        },
        {
          "id": "L5C",
          "type": "led",
          "params": {
            "forwardVoltage": "3 V",
            "forwardCurrent": "20 mA",
            "color": "branco"
          },
          "pins": [
            "A",
            "K"
          ],
          "layout": {
            "x": 1260,
            "y": 640,
            "rotation": 90
          }
        },
        {
          "id": "R6",
          "type": "resistor",
          "params": {
            "resistance": "150 Ω",
            "powerRating": "0,25 W"
          },
          "pins": [
            "1",
            "2"
          ],
          "layout": {
            "x": 1380,
            "y": 160,